{
  "$schema": "https://json-schema.org/draft/2020-12/schema",
  "$id": "https://cumcm.local/contracts/subagent_audit/v1",
  "title": "Native Subagent Audit",
  "version": "1.0.0",
  "type": "object",
  "required": [
    "audit_id",
    "role",
    "round",
    "independent",
    "read_only",
    "peer_output_access",
    "model",
    "reasoning_setting",
    "bundle_id",
    "bundle_hash",
    "verdict",
    "findings",
    "blockers",
    "writes_observed",
    "nested_codex_used",
    "api_key_used",
    "created_at",
    "output_hash"
  ],
  "properties": {
    "audit_id": {"type": "string", "minLength": 1},
    "role": {
      "enum": [
        "evidence_sufficiency_auditor",
        "adjudication_policy_prosecutor",
        "dissent_and_cost_auditor",
        "reproducibility_auditor",
        "automated_decision_auditor",
        "authorization_dependency_prosecutor",
        "shadow_scope_security_auditor",
        "protocol_cost_dissent_auditor",
        "final_shadow_authorization_auditor"
      ]
    },
    "round": {"enum": ["FIRST_ROUND", "POST_DECISION"]},
    "independent": {"const": true},
    "read_only": {"const": true},
    "peer_output_access": {"enum": ["NONE", "FROZEN_PREDECESSORS_ONLY"]},
    "model": {"type": "string", "minLength": 1},
    "reasoning_setting": {"type": "string", "minLength": 1},
    "bundle_id": {"type": "string", "minLength": 1},
    "bundle_hash": {"type": "string", "pattern": "^[0-9a-f]{64}$"},
    "verdict": {"enum": ["PASS", "FAIL", "RETEST_REQUIRED", "ABSTAIN"]},
    "findings": {
      "type": "array",
      "items": {
        "type": "object",
        "required": [
          "finding_id",
          "severity",
          "target",
          "statement",
          "evidence_refs",
          "file_references",
          "testability",
          "required_test",
          "pass_condition",
          "status"
        ],
        "properties": {
          "finding_id": {"type": "string", "minLength": 1},
          "severity": {"enum": ["BLOCKER", "ERROR", "WARNING", "INFO"]},
          "target": {"type": "string", "minLength": 1},
          "statement": {"type": "string", "minLength": 1},
          "counterexample": {"type": ["string", "null"]},
          "evidence_refs": {"type": "array", "items": {"type": "string"}, "minItems": 1},
          "file_references": {"type": "array", "items": {"type": "string"}, "minItems": 1},
          "testability": {"enum": ["TESTABLE", "NON_TESTABLE_CLAIM"]},
          "required_test": {"type": ["string", "null"]},
          "pass_condition": {"type": ["string", "null"]},
          "status": {"enum": ["OPEN", "RESOLVED", "UNRESOLVED"]}
        },
        "additionalProperties": false
      }
    },
    "blockers": {"type": "array", "items": {"type": "string"}, "uniqueItems": true},
    "cost_assessment": {
      "type": ["object", "null"],
      "properties": {
        "benefit_metrics": {"type": "array", "items": {"type": "string"}},
        "token_cost": {"type": "string"},
        "time_cost": {"type": "string"},
        "maintenance_cost": {"type": "string"},
        "stop_conditions": {"type": "array", "items": {"type": "string"}},
        "simplest_alternative": {"type": "string"}
      },
      "required": ["benefit_metrics", "token_cost", "time_cost", "maintenance_cost", "stop_conditions", "simplest_alternative"],
      "additionalProperties": false
    },
    "writes_observed": {"const": false},
    "nested_codex_used": {"const": false},
    "api_key_used": {"const": false},
    "api_calls": {"const": 0},
    "web_used": {"const": false},
    "mcp_used": {"const": false},
    "majority_vote_used": {"const": false},
    "expected_conclusion_visible": {"const": false},
    "uncertainties": {"type": "array", "items": {"type": "string"}, "uniqueItems": true},
    "created_at": {"type": "string", "format": "date-time"},
    "output_hash": {"type": "string", "pattern": "^[0-9a-f]{64}$"}
  },
  "allOf": [
    {
      "if": {
        "properties": {
          "role": {
            "enum": [
              "authorization_dependency_prosecutor",
              "shadow_scope_security_auditor",
              "protocol_cost_dissent_auditor",
              "final_shadow_authorization_auditor"
            ]
          }
        },
        "required": ["role"]
      },
      "then": {
        "required": [
          "api_calls",
          "web_used",
          "mcp_used",
          "majority_vote_used",
          "expected_conclusion_visible",
          "uncertainties"
        ]
      }
    }
  ],
  "additionalProperties": false
}
